{
  "_metadata": {
    "format": "svj-combination",
    "version": "0.101",
    "description": "6x4 tractor unit and 3-axle air-sprung semi-trailer joined at the fifth wheel (spherical joint: yaw is the articulation angle)."
  },
  "id": "tractor_semi",
  "name": "6x4 tractor with 3-axle semi-trailer",
  "units": [
    {
      "id": "tractor",
      "file": "../skeleton_6x4_camelback_tractor.svj.json",
      "root": true
    },
    {
      "id": "trailer",
      "file": "../skeleton_3axle_air_semi_trailer.svj.json"
    }
  ],
  "connections": [
    {
      "id": "fifth_wheel",
      "name": "Fifth wheel coupling",
      "a": "tractor.fifth_wheel",
      "b": "trailer.kingpin",
      "joint": {
        "joint_type": "spherical",
        "range": {
          "min": [
            -0.1,
            -0.1,
            -1.5
          ],
          "max": [
            0.1,
            0.1,
            1.5
          ]
        }
      }
    }
  ],
  "poses": [
    {
      "id": "turning_left",
      "name": "Tractor-trailer turning",
      "values": {
        "fifth_wheel": [
          0,
          0,
          -0.35
        ]
      }
    }
  ]
}
